{
  "alarm_log_id": "ALM-LOG-EVT-U2-2024-0847",
  "event_id": "EVT-U2-2024-0847",
  "asset_id": "U2-CONDENSER-MAIN",
  "generated_at": "2024-07-14T06:00:00Z",
  "window": {
    "start": "2024-06-30T00:00:00Z",
    "end": "2024-07-14T04:00:00Z"
  },
  "alarms": [
    {
      "alarm_id": "ALM-U2-CNDSR-BP-TREND",
      "timestamp": "2024-06-30T12:00:00Z",
      "description": "Condenser backpressure trending advisory \u2014 sustained rise above 2.0 inHg for 72 h; advisory threshold",
      "priority": "low",
      "state": "active",
      "component_id": "U2-CND-EXPANSION-JOINT-EXHAUST",
      "system": "secondary-side-condenser",
      "setpoint": 2.0,
      "actual_value": 2.01,
      "unit": "inHg",
      "acknowledged_at": "2024-07-01T08:00:00Z",
      "acknowledged_by": "U2-OPS-SHIFT-A"
    },
    {
      "alarm_id": "ALM-U2-HVAC-VIB-H",
      "timestamp": "2024-07-04T09:33:00Z",
      "description": "Turbine bay HVAC fan A bearing vibration high \u2014 0.52 in/s exceeds 0.35 in/s setpoint",
      "priority": "medium",
      "state": "active",
      "component_id": "U2-HVAC-TURBINE-BAY-FAN-A",
      "system": "turbine-building-hvac",
      "setpoint": 0.35,
      "actual_value": 0.52,
      "unit": "in_s_peak",
      "acknowledged_at": "2024-07-04T09:45:00Z",
      "acknowledged_by": "U2-MAINT-SHIFT"
    },
    {
      "alarm_id": "ALM-U2-CNDSR-BP-H",
      "timestamp": "2024-07-12T14:15:00Z",
      "description": "Condenser backpressure high \u2014 2.51 inHg above 2.50 inHg high setpoint; engineering evaluation threshold",
      "priority": "medium",
      "state": "active",
      "component_id": "U2-CND-EXPANSION-JOINT-EXHAUST",
      "system": "secondary-side-condenser",
      "setpoint": 2.5,
      "actual_value": 2.51,
      "unit": "inHg",
      "acknowledged_at": "2024-07-12T14:22:00Z",
      "acknowledged_by": "U2-OPS-SHIFT-C"
    },
    {
      "alarm_id": "ALM-U2-CNDSR-BP-HH",
      "timestamp": "2024-07-14T03:22:00Z",
      "description": "Condenser backpressure high-high \u2014 3.02 inHg above 3.00 inHg runback setpoint; turbine load runback actuated",
      "priority": "critical",
      "state": "active",
      "component_id": "U2-CND-EXPANSION-JOINT-EXHAUST",
      "system": "secondary-side-condenser",
      "setpoint": 3.0,
      "actual_value": 3.02,
      "unit": "inHg",
      "acknowledged_at": "2024-07-14T03:25:00Z",
      "acknowledged_by": "U2-OPS-SHIFT-D"
    },
    {
      "alarm_id": "ALM-U2-TRB-RUNBACK",
      "timestamp": "2024-07-14T03:22:10Z",
      "description": "Turbine automatic load runback initiated \u2014 backpressure setpoint exceeded; power reduced 97% to 85%",
      "priority": "critical",
      "state": "cleared",
      "component_id": null,
      "system": "turbine-protection",
      "setpoint": null,
      "actual_value": null,
      "unit": null,
      "acknowledged_at": "2024-07-14T03:26:00Z",
      "acknowledged_by": "U2-OPS-SHIFT-D"
    }
  ],
  "quality": {
    "missing_fraction": 0.0,
    "clock_sync_ok": true,
    "quality_flags": []
  },
  "provenance": {
    "generated_by": "show-and-tell-fixture-generator",
    "query_params": {
      "test_case": "TC-3",
      "scenario": "condenser-vacuum-loss-pwr-u2"
    }
  }
}