{
  "alarm_log_id": "ALM-LOG-E2026-03-10-001",
  "event_id": "E2026-03-10-001",
  "asset_id": "U1-RPS-CORE",
  "generated_at": "2026-03-10T16:00:00Z",
  "window": {
    "start": "2026-03-10T14:21:00Z",
    "end": "2026-03-10T14:24:00Z"
  },
  "alarms": [
    {
      "alarm_id": "ALM-U1-FCV-FW3301-DEV",
      "timestamp": "2026-03-10T14:21:18Z",
      "description": "FW Control Valve SG-3 position deviation — U1-FCV-FW-3301 exceeded ±2% setpoint tolerance",
      "priority": "medium",
      "state": "cleared",
      "component_id": "U1-FCV-FW-3301",
      "system": "feedwater",
      "setpoint": 2.0,
      "actual_value": 4.0,
      "unit": "percent_deviation",
      "acknowledged_at": "2026-03-10T14:21:35Z",
      "acknowledged_by": "U1-OPS-CONSOLE"
    },
    {
      "alarm_id": "ALM-U1-NI-RPS4-HH",
      "timestamp": "2026-03-10T14:22:03Z",
      "description": "Reactor trip — NI channel 4 high-high flux — U1-NI-RPS-4A exceeded 105% rated power trip setpoint; SCRAM initiated",
      "priority": "critical",
      "state": "active",
      "component_id": "U1-NI-RPS-4A",
      "system": "reactor-protection",
      "setpoint": 105.0,
      "actual_value": 112.3,
      "unit": "percent_rated",
      "acknowledged_at": "2026-03-10T14:23:45Z",
      "acknowledged_by": "U1-OPS-SS"
    },
    {
      "alarm_id": "ALM-U1-CRD2214-POS",
      "timestamp": "2026-03-10T14:22:13Z",
      "description": "CRD 2214 position indicator deviation — 2-step change during rod insertion — T+10s after trip",
      "priority": "low",
      "state": "cleared",
      "component_id": "U1-CRD-2214",
      "system": "reactor-protection",
      "setpoint": null,
      "actual_value": null,
      "unit": null,
      "acknowledged_at": "2026-03-10T14:24:00Z",
      "acknowledged_by": "U1-OPS-CONSOLE"
    }
  ],
  "quality": {
    "missing_fraction": 0.0,
    "clock_sync_ok": true,
    "quality_flags": []
  },
  "provenance": {
    "generated_by": "show-and-tell-fixture-generator",
    "query_params": {"test_case": "TC-4", "scenario": "reactor-trip-ni-spurious"}
  }
}
