{
  "alarm_log_id": "ALM-LOG-E2026-04-15-001",
  "event_id": "E2026-04-15-001",
  "asset_id": "CONDENSER_TRAIN_A",
  "generated_at": "2026-04-15T15:00:00Z",
  "window": {
    "start": "2026-04-15T13:10:00Z",
    "end": "2026-04-15T14:15:00Z"
  },
  "alarms": [
    {
      "alarm_id": "ALM-U1-AR-001",
      "timestamp": "2026-04-15T13:22:00Z",
      "description": "Air Removal Train B DP High — U1-DPT-AR-2201B above 4.8 inH2O setpoint",
      "priority": "high",
      "state": "active",
      "component_id": "U1-AIR-EJECTOR-B",
      "system": "secondary-side-condenser",
      "setpoint": 4.8,
      "actual_value": 5.1,
      "unit": "inH2O",
      "acknowledged_at": "2026-04-15T13:24:30Z",
      "acknowledged_by": "U1-OPS-CONSOLE"
    },
    {
      "alarm_id": "ALM-U1-CND-004",
      "timestamp": "2026-04-15T13:24:00Z",
      "description": "Condenser Backpressure First Threshold Alarm — U1-PT-CND-4201 above 1.80 inHgA",
      "priority": "high",
      "state": "active",
      "component_id": "CONDENSER_TRAIN_A",
      "system": "secondary-side-condenser",
      "setpoint": 1.8,
      "actual_value": 1.85,
      "unit": "inHgA",
      "acknowledged_at": "2026-04-15T13:25:10Z",
      "acknowledged_by": "U1-OPS-CONSOLE"
    },
    {
      "alarm_id": "ALM-U1-CND-005",
      "timestamp": "2026-04-15T13:26:00Z",
      "description": "Condenser Backpressure High Alarm — U1-PT-CND-4201 above 2.00 inHgA; turbine runback region",
      "priority": "critical",
      "state": "active",
      "component_id": "CONDENSER_TRAIN_A",
      "system": "secondary-side-condenser",
      "setpoint": 2.0,
      "actual_value": 2.1,
      "unit": "inHgA",
      "acknowledged_at": "2026-04-15T13:27:05Z",
      "acknowledged_by": "U1-OPS-CONSOLE"
    },
    {
      "alarm_id": "ALM-U1-HW-002",
      "timestamp": "2026-04-15T13:31:00Z",
      "description": "Hotwell Level High — U1-LT-HW-3301; non-condensable accumulation suspected",
      "priority": "medium",
      "state": "active",
      "component_id": "U1-HOTWELL",
      "system": "secondary-side-condenser",
      "setpoint": 52.0,
      "actual_value": 54.3,
      "unit": "inches",
      "acknowledged_at": "2026-04-15T13:33:00Z",
      "acknowledged_by": "U1-OPS-CONSOLE"
    },
    {
      "alarm_id": "ALM-U1-FW-003",
      "timestamp": "2026-04-15T13:34:00Z",
      "description": "Feedwater Flow Deviation — U1-FT-FW-2101A; ±1.2% from setpoint",
      "priority": "medium",
      "state": "cleared",
      "component_id": "U1-FW-PUMP-A",
      "system": "feedwater",
      "setpoint": null,
      "actual_value": null,
      "unit": null,
      "acknowledged_at": "2026-04-15T13:35:20Z",
      "acknowledged_by": "U1-OPS-CONSOLE"
    }
  ],
  "quality": {
    "missing_fraction": 0.0,
    "clock_sync_ok": true,
    "quality_flags": []
  },
  "provenance": {
    "generated_by": "show-and-tell-fixture-generator",
    "query_params": {
      "test_case": "TC-2",
      "scenario": "condenser-vacuum-loss-pwr-u1"
    }
  }
}
